{
    "schemaVersion": 1,
    "generatedAt": "2026-09-14T23:52:13Z",
    "pluginVersion": "0.1.0",
    "entries": [
        {
            "policy": "the package keeps its own methods simple :: ccn2",
            "symbol": "IanRodrigues\\CodeQuality\\Baseline\\BaselineFile::entry",
            "metric": {
                "name": "ccn2",
                "version": 1
            },
            "limit": 10,
            "accepted": 15,
            "path": "src/Baseline/BaselineFile.php"
        },
        {
            "policy": "the package keeps its own methods simple :: ccn2",
            "symbol": "IanRodrigues\\CodeQuality\\Baseline\\BaselineUpdater::measured",
            "metric": {
                "name": "ccn2",
                "version": 1
            },
            "limit": 10,
            "accepted": 11,
            "path": "src/Baseline/BaselineUpdater.php"
        },
        {
            "policy": "the package keeps its own methods simple :: ccn2",
            "symbol": "IanRodrigues\\CodeQuality\\Policies\\PolicyRunner::measure",
            "metric": {
                "name": "ccn2",
                "version": 1
            },
            "limit": 10,
            "accepted": 11,
            "path": "src/Policies/PolicyRunner.php"
        },
        {
            "policy": "the package keeps its own methods simple :: ccn2",
            "symbol": "IanRodrigues\\CodeQuality\\Selection\\Plugins\\OutputPlugin::handleArguments",
            "metric": {
                "name": "ccn2",
                "version": 1
            },
            "limit": 10,
            "accepted": 16,
            "path": "src/Selection/Plugins/OutputPlugin.php"
        },
        {
            "policy": "the package keeps its own methods simple :: ccn2",
            "symbol": "IanRodrigues\\CodeQuality\\Selection\\Scanner::declaredNamespace",
            "metric": {
                "name": "ccn2",
                "version": 1
            },
            "limit": 10,
            "accepted": 12,
            "path": "src/Selection/Scanner.php"
        },
        {
            "policy": "the package keeps its own parameter lists small :: params",
            "symbol": "IanRodrigues\\CodeQuality\\Analysis\\Measurement::__construct",
            "metric": {
                "name": "params",
                "version": 1
            },
            "limit": 4,
            "accepted": 6,
            "path": "src/Analysis/Measurement.php"
        },
        {
            "policy": "the package keeps its own parameter lists small :: params",
            "symbol": "IanRodrigues\\CodeQuality\\Analysis\\MethodMeasurements::__construct",
            "metric": {
                "name": "params",
                "version": 1
            },
            "limit": 4,
            "accepted": 7,
            "path": "src/Analysis/MethodMeasurements.php"
        },
        {
            "policy": "the package keeps its own parameter lists small :: params",
            "symbol": "IanRodrigues\\CodeQuality\\Analysis\\Support\\MethodAccumulator::__construct",
            "metric": {
                "name": "params",
                "version": 1
            },
            "limit": 4,
            "accepted": 5,
            "path": "src/Analysis/Support/MethodAccumulator.php"
        },
        {
            "policy": "the package keeps its own parameter lists small :: params",
            "symbol": "IanRodrigues\\CodeQuality\\Baseline\\BaselineEntry::__construct",
            "metric": {
                "name": "params",
                "version": 1
            },
            "limit": 4,
            "accepted": 7,
            "path": "src/Baseline/BaselineEntry.php"
        },
        {
            "policy": "the package keeps its own parameter lists small :: params",
            "symbol": "IanRodrigues\\CodeQuality\\Baseline\\MeasuredPolicy::__construct",
            "metric": {
                "name": "params",
                "version": 1
            },
            "limit": 4,
            "accepted": 5,
            "path": "src/Baseline/MeasuredPolicy.php"
        },
        {
            "policy": "the package keeps its own parameter lists small :: params",
            "symbol": "IanRodrigues\\CodeQuality\\Policies\\PolicyResult::__construct",
            "metric": {
                "name": "params",
                "version": 1
            },
            "limit": 4,
            "accepted": 8,
            "path": "src/Policies/PolicyResult.php"
        },
        {
            "policy": "the package keeps its own parameter lists small :: params",
            "symbol": "IanRodrigues\\CodeQuality\\Policies\\Violation::__construct",
            "metric": {
                "name": "params",
                "version": 1
            },
            "limit": 4,
            "accepted": 7,
            "path": "src/Policies/Violation.php"
        },
        {
            "policy": "the package keeps its own parameter lists small :: params",
            "symbol": "IanRodrigues\\CodeQuality\\Reporting\\RunRecorder::recordError",
            "metric": {
                "name": "params",
                "version": 1
            },
            "limit": 4,
            "accepted": 5,
            "path": "src/Reporting/RunRecorder.php"
        },
        {
            "policy": "the package keeps its own parameter lists small :: params",
            "symbol": "IanRodrigues\\CodeQuality\\Selection\\TargetCoverage::__construct",
            "metric": {
                "name": "params",
                "version": 1
            },
            "limit": 4,
            "accepted": 7,
            "path": "src/Selection/TargetCoverage.php"
        }
    ]
}
